{
  "schemaVersion": 2,
  "contentRevision": "ws-content-r2.1",
  "domain": "equipment",
  "records": [
    {
      "id": "EQD50-AC-CALIBRATE",
      "sourceDocumentId": "TOOL-LIST-001",
      "enabled": true,
      "codexIndex": 1142,
      "name": "교정환",
      "equipmentType": "ACCESSORY",
      "equipmentSlot": "ACCESSORY",
      "weaponClass": "",
      "displayMaterial": "RECOVERY_COMPASS",
      "definition": "EQUIP-DATA-D50-001",
      "rarity": "ABYSSAL",
      "itemLevel": 44,
      "firstDay": 41,
      "maxDurability": 1500,
      "toolTier": -1,
      "baseTemplateId": "EQL-AC-C01",
      "statInheritancePolicy": "INHERIT_ADD",
      "setId": "",
      "tags": [],
      "stats": {},
      "effectProfileId": "EQFX-EQD50-AC-CALIBRATE",
      "executionOpcode": "",
      "harvestProfileId": "",
      "resourceYieldMultiplier": 1.0,
      "durabilityCostPerSuccess": 0,
      "vanillaActionPassthrough": false,
      "effectText": "EQD50-AC-CALIBRATE` 교정환 | ACCESSORY | ABYSSAL 44 | C29 상호작용 실패 허용 오차 +5%, 중첩 불가 | AB41",
      "raw": [
        "1142",
        "EQD50-AC-CALIBRATE",
        "ACCESSORY",
        "ACCESSORY/CHARM",
        "RECOVERY_COMPASS",
        "EQUIP-DATA-D50-001"
      ]
    },
    {
      "id": "EQD50-AX-A41",
      "sourceDocumentId": "TOOL-LIST-001",
      "enabled": true,
      "codexIndex": 1143,
      "name": "잔향 절단도끼",
      "equipmentType": "AX",
      "equipmentSlot": "MAIN_WEAPON",
      "weaponClass": "AXE",
      "displayMaterial": "IRON_AXE",
      "definition": "EQUIP-DATA-D50-001",
      "rarity": "ABYSSAL",
      "itemLevel": 44,
      "firstDay": 41,
      "maxDurability": 1500,
      "toolTier": -1,
      "baseTemplateId": "EQD50-AX-L31",
      "statInheritancePolicy": "INHERIT_ADD",
      "setId": "",
      "tags": [
        "AXE"
      ],
      "stats": {},
      "effectProfileId": "EQFX-EQD50-AX-A41",
      "executionOpcode": "",
      "harvestProfileId": "",
      "resourceYieldMultiplier": 1.0,
      "durabilityCostPerSuccess": 0,
      "vanillaActionPassthrough": false,
      "effectText": "EQD50-AX-A41` 잔향 절단도끼 | 도끼 | 공성·보스 잔향 표식 피해 +10% | 비표식 피해 -4%",
      "raw": [
        "1143",
        "EQD50-AX-A41",
        "AX",
        "MAIN_WEAPON",
        "IRON_AXE",
        "EQUIP-DATA-D50-001"
      ]
    },
    {
      "id": "EQD50-AX-E21",
      "sourceDocumentId": "TOOL-LIST-001",
      "enabled": true,
      "codexIndex": 1144,
      "name": "변이 절단도끼",
      "equipmentType": "AX",
      "equipmentSlot": "MAIN_WEAPON",
      "weaponClass": "AXE",
      "displayMaterial": "IRON_AXE",
      "definition": "EQUIP-DATA-D50-001",
      "rarity": "EPIC",
      "itemLevel": 24,
      "firstDay": 21,
      "maxDurability": 800,
      "toolTier": -1,
      "baseTemplateId": "EQD20-AX-R01",
      "statInheritancePolicy": "INHERIT_ADD",
      "setId": "",
      "tags": [
        "AXE",
        "HEAVY",
        "MUTATION"
      ],
      "stats": {},
      "effectProfileId": "EQFX-EQD50-AX-E21",
      "executionOpcode": "",
      "harvestProfileId": "",
      "resourceYieldMultiplier": 1.0,
      "durabilityCostPerSuccess": 0,
      "vanillaActionPassthrough": false,
      "effectText": "EQD50-AX-E21` 변이 절단도끼 | 도끼·AXE | 서로 다른 변이 2개 적 강공 피해 +12% | 실행당 1회 | HEAVY,MUTATION",
      "raw": [
        "1144",
        "EQD50-AX-E21",
        "AX",
        "MAIN_WEAPON",
        "IRON_AXE",
        "EQUIP-DATA-D50-001"
      ]
    },
    {
      "id": "EQD50-AX-L31",
      "sourceDocumentId": "TOOL-LIST-001",
      "enabled": true,
      "codexIndex": 1145,
      "name": "중단 집행도끼",
      "equipmentType": "AX",
      "equipmentSlot": "MAIN_WEAPON",
      "weaponClass": "AXE",
      "displayMaterial": "IRON_AXE",
      "definition": "EQUIP-DATA-D50-001",
      "rarity": "LEGENDARY",
      "itemLevel": 34,
      "firstDay": 31,
      "maxDurability": 1100,
      "toolTier": -1,
      "baseTemplateId": "EQD50-AX-E21",
      "statInheritancePolicy": "INHERIT_ADD",
      "setId": "",
      "tags": [
        "AXE"
      ],
      "stats": {},
      "effectProfileId": "EQFX-EQD50-AX-L31",
      "executionOpcode": "",
      "harvestProfileId": "",
      "resourceYieldMultiplier": 1.0,
      "durabilityCostPerSuccess": 0,
      "vanillaActionPassthrough": false,
      "effectText": "EQD50-AX-L31` 중단 집행도끼 | 도끼 | 중단 직후 강공 피해 +15% | 6초, 실행 1회 | 강공 AP +8",
      "raw": [
        "1145",
        "EQD50-AX-L31",
        "AX",
        "MAIN_WEAPON",
        "IRON_AXE",
        "EQUIP-DATA-D50-001"
      ]
    },
    {
      "id": "EQD50-B30-AC01",
      "sourceDocumentId": "TOOL-LIST-001",
      "enabled": true,
      "codexIndex": 1146,
      "name": "다축 변이환",
      "equipmentType": "ACCESSORY",
      "equipmentSlot": "ACCESSORY",
      "weaponClass": "",
      "displayMaterial": "RECOVERY_COMPASS",
      "definition": "EQUIP-DATA-D50-001",
      "rarity": "ABYSSAL",
      "itemLevel": 30,
      "firstDay": 30,
      "maxDurability": 1500,
      "toolTier": -1,
      "baseTemplateId": "EQL-AC-C01",
      "statInheritancePolicy": "INHERIT_ADD",
      "setId": "",
      "tags": [],
      "stats": {},
      "effectProfileId": "EQFX-EQD50-B30-AC01",
      "executionOpcode": "",
      "harvestProfileId": "",
      "resourceYieldMultiplier": 1.0,
      "durabilityCostPerSuccess": 0,
      "vanillaActionPassthrough": false,
      "effectText": "EQD50-B30-AC01` 다축 변이환 | ACCESSORY | 다른 플레이어의 변이 대응 성공 뒤 PEN+8, 6초 | 자기 단독 발동 불가",
      "raw": [
        "1146",
        "EQD50-B30-AC01",
        "ACCESSORY",
        "ACCESSORY/CHARM",
        "RECOVERY_COMPASS",
        "EQUIP-DATA-D50-001"
      ]
    },
    {
      "id": "EQD50-B30-AR01",
      "sourceDocumentId": "TOOL-LIST-001",
      "enabled": true,
      "codexIndex": 1147,
      "name": "오염 공존 외피",
      "equipmentType": "ARMOR",
      "equipmentSlot": "ARMOR_CHEST",
      "weaponClass": "",
      "displayMaterial": "IRON_CHESTPLATE",
      "definition": "EQUIP-DATA-D50-001",
      "rarity": "ABYSSAL",
      "itemLevel": 30,
      "firstDay": 30,
      "maxDurability": 1875,
      "toolTier": -1,
      "baseTemplateId": "EQL-AR-C02",
      "statInheritancePolicy": "INHERIT_ADD",
      "setId": "",
      "tags": [],
      "stats": {},
      "effectProfileId": "EQFX-EQD50-B30-AR01",
      "executionOpcode": "",
      "harvestProfileId": "",
      "resourceYieldMultiplier": 1.0,
      "durabilityCostPerSuccess": 0,
      "vanillaActionPassthrough": false,
      "effectText": "EQD50-B30-AR01` 오염 공존 외피 | CHEST | 개인 오염 단계 3+ 피해 -10% | 받는 정화 -15%",
      "raw": [
        "1147",
        "EQD50-B30-AR01",
        "ARMOR",
        "ARMOR_CHEST",
        "IRON_ARMOR",
        "EQUIP-DATA-D50-001"
      ]
    },
    {
      "id": "EQD50-B30-OH01",
      "sourceDocumentId": "TOOL-LIST-001",
      "enabled": true,
      "codexIndex": 1148,
      "name": "변이 차단막",
      "equipmentType": "OFF",
      "equipmentSlot": "OFF_WEAPON",
      "weaponClass": "",
      "displayMaterial": "SHIELD",
      "definition": "EQUIP-DATA-D50-001",
      "rarity": "ABYSSAL",
      "itemLevel": 30,
      "firstDay": 30,
      "maxDurability": 1500,
      "toolTier": -1,
      "baseTemplateId": "EQL-OH-C01",
      "statInheritancePolicy": "INHERIT_ADD",
      "setId": "",
      "tags": [],
      "stats": {},
      "effectProfileId": "EQFX-EQD50-B30-OH01",
      "executionOpcode": "",
      "harvestProfileId": "",
      "resourceYieldMultiplier": 1.0,
      "durabilityCostPerSuccess": 0,
      "vanillaActionPassthrough": false,
      "effectText": "EQD50-B30-OH01` 변이 차단막 | OFF_WEAPON | 패링한 변이 패턴의 다음 파티 피해 -10%, 10초 | 자기 피해 감소는 -5%만",
      "raw": [
        "1148",
        "EQD50-B30-OH01",
        "OFF",
        "OFF_WEAPON",
        "SHIELD",
        "EQUIP-DATA-D50-001"
      ]
    },
    {
      "id": "EQD50-B30-UA01",
      "sourceDocumentId": "TOOL-LIST-001",
      "enabled": true,
      "codexIndex": 1149,
      "name": "무구의 정화 고리",
      "equipmentType": "UNARMED_SUPPORT",
      "equipmentSlot": "ACCESSORY",
      "weaponClass": "",
      "displayMaterial": "TRIPWIRE_HOOK",
      "definition": "EQUIP-DATA-D50-001",
      "rarity": "ABYSSAL",
      "itemLevel": 30,
      "firstDay": 30,
      "maxDurability": 1500,
      "toolTier": -1,
      "baseTemplateId": "EQL-UA-U01",
      "statInheritancePolicy": "INHERIT_ADD",
      "setId": "",
      "tags": [],
      "stats": {},
      "effectProfileId": "EQFX-EQD50-B30-UA01",
      "executionOpcode": "",
      "harvestProfileId": "",
      "resourceYieldMultiplier": 1.0,
      "durabilityCostPerSuccess": 0,
      "vanillaActionPassthrough": false,
      "effectText": "EQD50-B30-UA01` 무구의 정화 고리 | 권투 ACCESSORY | 정확 회피 반격 시 정화 충전형 사건 진행 +1, 15초 | 비전투 정화·자원 생성 없음",
      "raw": [
        "1149",
        "EQD50-B30-UA01",
        "UNARMED_SUPPORT",
        "ACCESSORY/CHARM",
        "TRIPWIRE_HOOK",
        "EQUIP-DATA-D50-001"
      ]
    },
    {
      "id": "EQD50-B40-AC01",
      "sourceDocumentId": "TOOL-LIST-001",
      "enabled": true,
      "codexIndex": 1150,
      "name": "수단 교대환",
      "equipmentType": "ACCESSORY",
      "equipmentSlot": "ACCESSORY",
      "weaponClass": "",
      "displayMaterial": "RECOVERY_COMPASS",
      "definition": "EQUIP-DATA-D50-001",
      "rarity": "ABYSSAL",
      "itemLevel": 40,
      "firstDay": 40,
      "maxDurability": 1500,
      "toolTier": -1,
      "baseTemplateId": "EQL-AC-C01",
      "statInheritancePolicy": "INHERIT_ADD",
      "setId": "",
      "tags": [],
      "stats": {},
      "effectProfileId": "EQFX-EQD50-B40-AC01",
      "executionOpcode": "",
      "harvestProfileId": "",
      "resourceYieldMultiplier": 1.0,
      "durabilityCostPerSuccess": 0,
      "vanillaActionPassthrough": false,
      "effectText": "EQD50-B40-AC01` 수단 교대환 | ACCESSORY | 서로 다른 중단 수단 3개 성공 시 파티 AP 8 | 패턴별 20초, 자기 효과 재발동 없음",
      "raw": [
        "1150",
        "EQD50-B40-AC01",
        "ACCESSORY",
        "ACCESSORY/CHARM",
        "RECOVERY_COMPASS",
        "EQUIP-DATA-D50-001"
      ]
    },
    {